{
  "$schema": "https://json-schema.org/draft/2020-12/schema",
  "title": "Normalized day review input",
  "type": "object",
  "additionalProperties": false,
  "properties": {
    "schema_version": {
      "const": 1
    },
    "date": {
      "type": "string",
      "format": "date"
    },
    "sources": {
      "type": "array",
      "maxItems": 64,
      "items": {
        "type": "object",
        "additionalProperties": false,
        "properties": {
          "id": {
            "type": "string",
            "pattern": "^[a-z][a-z0-9_-]{0,63}$"
          },
          "status": {
            "enum": [
              "ready",
              "partial",
              "missing"
            ]
          },
          "records": {
            "type": "array",
            "maxItems": 100000,
            "items": {
              "type": "object",
              "additionalProperties": false,
              "properties": {
                "id": {
                  "type": "string",
                  "pattern": "^[a-z][a-z0-9_-]{0,63}$"
                },
                "label": {
                  "type": "string",
                  "minLength": 1,
                  "maxLength": 300
                },
                "start": {
                  "type": "string",
                  "format": "date-time"
                },
                "end": {
                  "type": "string",
                  "format": "date-time"
                },
                "episode": {
                  "type": "string",
                  "pattern": "^[a-z][a-z0-9_-]{0,63}$"
                },
                "category": {
                  "type": "string",
                  "pattern": "^[a-z][a-z0-9_-]{0,63}$"
                }
              },
              "required": [
                "id",
                "label",
                "start",
                "end"
              ],
              "description": "Human/device records require episode and category. Machine records forbid both. The CLI checks against config source kind."
            }
          }
        },
        "required": [
          "id",
          "status",
          "records"
        ]
      }
    },
    "unknown_activities": {
      "type": "array",
      "maxItems": 100000,
      "items": {
        "type": "object",
        "additionalProperties": false,
        "properties": {
          "id": {
            "type": "string",
            "pattern": "^[a-z][a-z0-9_-]{0,63}$"
          },
          "label": {
            "type": "string",
            "minLength": 1,
            "maxLength": 300
          },
          "category": {
            "type": "string",
            "pattern": "^[a-z][a-z0-9_-]{0,63}$"
          },
          "source_id": {
            "type": "string",
            "pattern": "^[a-z][a-z0-9_-]{0,63}$"
          }
        },
        "required": [
          "id",
          "label",
          "category",
          "source_id"
        ]
      }
    },
    "intentions": {
      "type": "array",
      "maxItems": 100,
      "items": {
        "type": "object",
        "additionalProperties": false,
        "properties": {
          "label": {
            "type": "string",
            "minLength": 1,
            "maxLength": 300
          },
          "category": {
            "type": "string",
            "pattern": "^[a-z][a-z0-9_-]{0,63}$"
          }
        },
        "required": [
          "label",
          "category"
        ]
      }
    }
  },
  "required": [
    "schema_version",
    "date",
    "sources"
  ]
}
